,review
356,rd time order ghee st time ghee perfect solidifi tast gr directli bulletproof coffe nd time tast poor directli bpc never solidifi mother said rd time thought nd time batch problem problem repeat solidifi tast even wors directli indirectli nd time p coffe ingredi amul ghee guess lot potenti adulter within scope product qualiti control mother dairi dynam much much better amul ghee lost custom
357,healthi tasti
358,regularli buy product amazon st time face disappoint upon open packag found himalaya moistur alo vera face wash miss half
359,usual product de soap normal bath soap pleas buy realli look deo soap
360,end give beauti colour use style n brown lesser time orangish kept fr long orang golden u experi storb home cheap rate great result use britt simpli wherev u want glove n damg hair takecar u oil spa regularli lighter hair tend look rough go follow instruct given usag chang ur look mt
361,updat horribl bath use far year old son develop hive use soap turn dark fragranc strong liter hit never buy bar ok ok good claim use kid feel cleans well dri skin use face found skin still dri wash noth great moisturis part feel fresh wash face bar like wash face realli doubt cleans ur skin
362,practic grown eat sugar coat delight never fail
363,nice watch
364,tast store bought gold moreov tetra pack awesom recycl henc environ friendli though littl bit pricier plastic pouch yet worth consid futur
365,damag upon deliverycool goodnot noisyampl space famili good lookdri storag nice door doesnt close need push itglasswar delic big factor water remov cabinet wierdli placedonli ice cube tray provid
366,nice
367,good deal
368,good tea time
369,gift dad love watch
370,leav hair dri wash compulsari use condition
371,work wear one day automat watch mention specif
372,great
373,use year best soap ever
374,want buy see buy option realli disappoint also old custom
375,tast like origin mango pulp acid good
376,use differ variant cinthol one highli disappoint scale fragranc cool effect melt easili sure origin stop use soap know rest
377,good product add creami textur add dish tast nice
378,nice product
379,color highlight natur hair highlight bleach hair kit contain blond powder bleach hair contain develop color appli give visibl result natur hair although seen sunlight get color desir
380,good
381,excel product smell tast flavour everi custom idea tea take without dought drink milk without milk thank amazon thank seller satisfi
382,perfect good condit although plastic box crack watch origin work fine
383,realli like pack soap rememb soon unpack surpris fresh smell come amaz soap foam feel soft rich white moistur skin perfectli oili skin want soap balanc skin moistur moistur dri skin soap pretti much also last good time also soap give foam capabl soon becom small one still give great lather would recommend everyon
384,watch awesom batteri life long last addit featur make worth buy look fashion well
385,box mrp mention rs pack pack becom rs sell rs box kindli take action
386,nice steel
387,best price mrp discount
388,love face wash nice clean feel post use mostli use high end face product coz dri skin usual get market oili skin new fav well done himalaya
389,gave tri dettol antisept avail sure effect unlik dettol water turn orang colour upon use savlon cant use laundri especi white cloth doesnt stain cloth give mild peachi tint come scent read review mention smell better dettol dont feel differ fact prefer dettol smell may use sinc long
390,masla tea best tast aroma purchas four differ compani masala tea compar tast l found test societi masala three compani masala tea small quantiti tea leav requir prepar arom tasti tea continu purchas tea
391,tata product good watch pathet strap strap break two month use
392,one best budget analog watch belt rs segment watch impress one excel look good build qualiti good strap design color perfect fit big black dial radium light glow function overal trust product buy cheer
393,tri almost ghee brand avail market alway come back patanjali ghee find brand give flavor textur
394,way best love scent
395,take tata gold tea sinc two decad tri mani cheap expens product tata gold non replac new golden color pack attract
396,product good mrp packet wherea amazon show correct
397,fav go cream blemish noth help much get rid blemish start use felt differ quickli sometim thought stop work stop use realiz work stop use made huge differ stop
398,someon alreadi open
399,flavou awesom pack punch stronger side spectrum prefer lighter flavour look someth els deliveri fast reacher good condit
400,awesom hai
401,like
402,given packet wherea thi put packet menu
403,nice
404,watch beauti contain
405,nice purpl stay long pretti good color extrem dark hair buy hair bleach develop
406,make good tea time snack
407,use almost month nearli work good style simpli nuce
408,worth nice heavi look
409,money wast product work properli spray time make dispos bill box stop work next day use air wick earlier work perfectli avoid product seller may clear defect stock
410,thick bead know want scrub face everyday foam like facewash smell like pulpi orang appli smell bit like turmer wash face look bright use bright previou facewash made skin dri annoy sinc skin alreadi dri without made wors definit worth money got rs sale still worth think work tan still dont see chang skin disappoint
411,comment tata product best amongst best amazon servic mrp u ppl charg complaint
412,good tea
413,might think would buy refil instead new bottl save money even reduc plastic use howev buy refil origin dettol handwash soon refil bottl start use notic first color lighter notic lighter notic scent faint compar origin one bottl ignor time like cant picki two day later notic skin peel like never use handwash long time never happen even risk givin pack away someon free aw end dustbin
414,everi household need dettol product especi kid around new dettol disinfect menthol fragranc leav fresh feel smell entir hous use along clean water recommend clean wash
415,bottl seal expect big brand may b fake product
416,receiv product safe n intact first time receiv old date product tea powder month older ketchup also month older ketchup use within month kg order sir order purchas tata tea powder two month ago product receiv mfg date receiv mfg productsloos faith groceri order
417,qualiti fine howev pack improv receiv damag one leak outer cover hope everyth fine order
418,equival brand avail market use year occas year friend rel happi
419,work spray point get press function spray automat unnecessarili order auto machin said n think alreadi fault piec co cartoon product also perfect
420,great
421,love tast flavour easi make hope bring larger pack sachet someth
422,order friend open realli love great packag everi item descript amazon site
423,never purchas varieti alway use dettol antisept liquid lock vanish local medicin store move onlin even difficult get one also howev lot attempt got use shave purpos think equal good antisept varieti leav fresh fell wash face leav refresh fragranc mix bath water much pleas use varieti buy futur
424,becom joke small size hardli product term heft packag whole bin came part pantri order bother follow redund custom care
425,use dettol last year trust fake product origin cover smell bad allerg bite skin wast money product broken trust amazon never expect cheat custom
426,good
427,textur good finer cheap either get nivea gm price qualiti also good soft skin fragranc also good guess fan sandalwood
428,love tea tata gold tea one best product tata use daili use got product amazon got recent manufactur product product genuin product varieti tea avail market among tata gold tea best tea accord daili use got product discount price bought product super valu day manufactur date product half month ago date receiv product hand henc recent manufactur product also product good shelf life amazon deliv product good condit packag product awesom damag amaz amazon pantri box hard packag insert air fill seal packet item move pressur absorb air fill packet deliveri order next day morn deliveri man took packag insid hous heavi kept pantri box tabl told behavior deliveri man good highli satisfi product recommend buy product without fear hesit believ satisfi receiv product use
429,product almost similar actual one day date cycl work properli week name wrong like sunday written sab mri
430,got expir pack
431,seal brokenand total damag packet
432,excel tast
433,import aspect consid place order safe even swallow small kid love brush tooth past safe ingredi
434,patanjali alway awesom
435,order step track work replac receiv use watch even pack
436,good deliveri
437,origin fastrack watch st copi pleas buy insid watch part shake found went shop cut chain shopkeep told origin
438,far better hair oil feel result immedi appli
439,complet natur feel safe son use dento shine tooth past chang lott go safe
440,good
441,sensit acn prone skin activ acn scar face face wash show visibl result usag gentl skin pleasant mild fragranc rip natur oil face leav face deepli cleans smooth wash complet valu money
442,good
443,one hesit buy product origin scent fresh die old school
444,amaz origin smart watch littl heavi watch everyday use
445,good biscuit broken insid pack
446,make sure amazon deliv fresh producti issu month packag far product concern realli good
447,suit small wrist hand men well like thank amazon
448,cost higher factori price believ qualiti watch superior purchas dad run good last month
449,curli hair recov heat damag henc went natur month ago need cg friendli shampoo one job consist thick like shampoo clear liquid sinc babi shampoo adult may requir good ml shampoo one time use given price worth leav hair scalp feel clean
450,nice product skin combin type oili n dri work magic especi winter give u extra soft
451,best health drink whole famili amul pro health drink avail market econom price tag made india amul
452,good product
453,amul famou slogan ofcours favourit utterli butterli delici amul
454,sensit acn prone skin activ acn scar face face wash show visibl result usag gentl skin pleasant mild fragranc rip natur oil face leav face deepli cleans smooth wash complet valu money
455,dri best suit oili skin skin type best avoid
456,good
457,price highest product compani rang assum would best color flavor howev disspoint flavor similar cheaper leaf tea even good dust varieti also tea leav foul chemic odour come usual tea leav give fine franganc prepar full milk black buy sure
458,thick bead know want scrub face everyday foam like facewash smell like pulpi orang appli smell bit like turmer wash face look bright use bright previou facewash made skin dri annoy sinc skin alreadi dri without made wors definit worth money got rs sale still worth think work tan still dont see chang skin disappoint
459,tasti
460,know bottl duplic discount son daughter instant hair loss threw revert johnson hair loss stop anoth day use
461,dislik product bcoz burn appli face damag exist skin tone nice fregrenc worthless money product pl buy product
462,worst ghee come market tast smell look like dalda sure dalda
463,realli tea fan definit unawar tata tea famili trust brand mani year tri almost everi standard brand tea avail market last say tata tea best avail brand print price although tata tea brand alreadi quit effici serv purpos current addit tata tea gold actual make sens qualiti enhanc ad dri whole tea leav process tea mix whole leaf result enhanc flavor color prepar tea concentr milder like balanc golden color real tast flavor design exactli keep mind expect user agre requir strong color flavor need add littl leav prepar tata tea gold meant peopl like strong color seeker workabl peopl want real flavor natur golden color final prepar although even singl tea spoon enough prepar natur golden cup full real tea one may keep mind use tea contain real whole dri tea leav may take minut prepar comparison brand reason without ad artifici color whole dri tea leav take time releas real flavor content tast premium expect alway packag good enough visual ergonom principl well taken consider design smarter visual appeal previou pack use product year random review famili use product make everi singl cup day night x whenver feel like one
464,super product
465,excel deoderis soap tcc use especi summer skin brighten soap
466,pack fresh overal nice help skin feel fresh winter also help case burn got discount form amazon pay
467,well much month old almost teeth brush product good start eat tast rather babi way natur tast good appli bit teeth thn forgot kept buy satisfact babi realli small understand brush spit eat go
468,hai guy product arriv within one order thumsup amazon posit receiv brand new product mfg date smell smooth heavenli skin irrit allerg reaction strength shampoo mild kid even cri bath cheaper local retail store thank read
469,bought watch rs awesom classic watch price look eleg classic amd sleek design ad featur date urban design valu money dial color black case shape round band color brown band materi leather watch movement type quartz watch display type analog month manufactur warranti remov plastic crown start watch recommend custom look small dial size watch wore wiyh casual shirt look highli highli recommend look classic design watch rs best purchas
470,tast good
471,watch eleg look peopl love feel weight wrist definit go perfect item gift love one price rang
472,awesom product truli genuin good skin
473,suitabl scalp dandruff come
474,hai guy product arriv within one order thumsup amazon posit receiv brand new product mfg date smell smooth heavenli skin irrit allerg reaction strength shampoo mild kid even cri bath cheaper local retail store thank read
475,
476,two bottl one bottl unseal understand open deliveri pleas answer quir st seal nd alreadi open
477,product good mrp packet wherea amazon show correct
478,amaz product amul tast remain throughout year qualiti still awesom alway amaz deliveri amazon
479,order arriv dec howev open seal notic unusu deterg like smell smell like sandalwood oil seem either fraudul product insert contain sourc mayb done uneth third parti want return item toiletri product option unhappi purchas
480,size biscuit price joke tast good
481,super watch amazon weight daili use
482,good gelit realli prevent pimplesgood type skincan use night cream well primer
483,nice qualiti product great product buy product amazon pantri regularli thank amazon great qualiti product afford rate
484,gem old trust indian brand great valu money fragranc nice powderi scent refresh without overpow soap cleans good great nice creami far beyond modest price fact nice natur creami slipperi dove also seem long last clear winner regular featur bath rack
485,good product
486,look like duplic buy near groceri shop tast differ deliv amazon pantri packet tast inferior aroma color
487,summer great feel cool cool yeah fragnac last long enough use past year
488,good
489,origin product good packag longer expiri date less price usual mrp must buy product everi household got rs
490,nice herbal product
491,great soap bar catch free bar half size regular bar howev use travel kit
492,overal price worth fit laptop upto helmet smaller size fruit veget put without issu look pretti decent home smell horribl everi cycl room get pollut one rack mean effect place soap stack disinfect possibl take caution less cycl ensur one switch oper plug play timer follow manual wait beep display curiou know time laps wire three pin earth critic felt mild shock
493,everyth excel titan watch receiv fat needl shown miss dial quit differ imag shown amazon india probabl item receiv differ model anyway never mind get dial needl chang regist titan workshop
494,first time tri patanjali product wast hard earn money noth say posit ghee dosent smell like ghee either tast like vanaspathi cheap oil dont tri buy patanjali ghee els readi write frustur review like
495,tasti drink
496,classic watch formal occas satisfi qualiti product servic amazon
497,use product fragranc excel like effect close space includ car toilet bathroom offic etc easi instal zanzat fragranc last roughli fifteen day period pleas guest
498,realli love servic amazon deliveri return polici pack servic toward custom applic product star averag plu product odour materi like smell like medic facewash dont know whether fight acn pimpl pimpl acn issu concern switch herbal facewash first pick aroma magic tea tree oil face good appli face sever month suddenli acn pimpl attack face know caus switch mamaearth face wash noth face use day result got product fail cure pimpl acnei know kind pimpl attack two three pimpl use occur heal two three omg final consult doctor product purchas recommand fit tuber youtub face free pimpl acn use product replac chemic product suffer pimpl acn dont know facewash work everybodi skin caus occur pimpl acn buy tri
499,insuffici quantiti develop neither replac take action think anyon buy effect without develop
500,gift watch friend love perfect condit work properli
501,got empti sooner expect lol good stuffedit time problem half pack empti liquid total rubbish lather liquid bottom smell like phenylrealis fake tamper packag india ever free malpractic adulteri disappoint buy
502,bad product hair fall increas much order shampoo mask oil noth stop hairfallaft wash hair fall badli
503,shown pictur valu money quick deliveri
504,nice product howev would like option lemon grass flavour also price
505,bad product code work suddenli tri open overrid key n open tri call custom care n say charg rs technician visit month bought bad product
506,qualiti alway best time price high prime member free deliveri fast deliveri option good
507,tast store bought gold moreov tetra pack awesom recycl henc environ friendli though littl bit pricier plastic pouch yet worth consid futur
508,simpli awesom spaciou look good issu think get well go
509,recent gift item parent anniversari howev product good easi use respons touch panel absolut stationari els alarm set make difficult carri transport also godrej support team quick answer queri receiv product scratch amazon ensur product appear brand new sinc custom pay brand new product overal worth buy secur need
510,noth gentl shampoo himalaya disclos entir ingredi list contain methylchloroisothiazolinon proven toxic cheat consum like
511,amazon sale servic pathet product defect wont refund refriger make noisedoor wont shut properlyback panel coil hot danger childrenamazon start sell defect low grade product ask refund deni technician wil come repair repair newli bought product note noth like prime member even prime member get resolut hopeless sale product good dont buy go escal corp email let see happen updat tatacliq day return polici refriger let buy indian websit amazon wast sale servic
512,receiv product well pack box two box actual pack realli appreci pack ensur none pack damag tast cours sooo sooth
513,bought cream mom ladi believ work great fanci costli cream ye oili tht ok bc result wish serum seri thanx amazon ad himalaya pl like ye u love review bc free u
514,realli give star lightli love soap smell great last longer other sandalwood soap tri lather well rins away well fragranc last littl afterward dri sticki residu job well done amount bar price ad bonu tri well known brand like better
515,good spici young peopl like old children strong mix normal tea better
516,good look nice awesom perfect look best qualiti
517,summer great feel cool cool yeah fragnac last long enough use past year
518,thank amazon recommend engin suggest mysor sandal talc never knew mysor sandal brand talc purchas mysor sandal soap week back perhap due purchas amazon would recommend well glad click suggest bought one good bye exist pond sandalwood talc review compar mysor sandal talc vi vi pond sandalwood talcpro fragranc first thing hit soon open bottl smell pure authent sandal wood perfum pond talc powder mysor sandal talc allow decid size hole want bottl pond one forc hole soon want top cover alway hate pond talc pond realli want use need fragranc last longer pond sandalwood talc even though day believ tri one judg review talk powder fine powder noth like powder fine pond sandalwood talc less bottl seal hologram sticker assur genuin product mysor sandal somehow like press fit top bottl keep fragranc intact bottl use pond bottl twist close top realli seal tight way shut close bottl last least mysor sandal talc cheaper pond sandalwood earth would ever buy pond con none spot yet
519,nice
520,flavour tea goodit includ littl leaf see itmust tri tea
521,earlier societi tea powder good qualiti flavour societi come societi qualiti degrad amlagm dust chaipatti detter qialiti hope best societi best societi
522,super product
523,make good tea time snack
524,got rs fregranc good long last hour depend situat price good soap
525,black beauti
526,beauti watch shown one problem easi see time three pointer differ still happi bought
527,origin product good packag longer expiri date less price usual mrp must buy product everi household got rs
528,ok product
529,start safe arriv low batteri messag mean could anyth els go get new batteri brand new item get thing order safe work well serv purpos howev manual provid obsolet instruct match product solut post onlin either want program safe figur custom servic personnel help either kept tri forc get technician come hous cost rs program devic complet defeat purpos onlin shop fall rather ridicul big brand like godrej case anyon els need program home code abl hope work instruct indic press actual mean lock instruct indic tri press clear everi time press got error messag go step list chang person code home mode need access program pg code mean differ featur program go step chang number suit get last digit instruct written book figur last digit chang go program chang last number abl go back chang person code home mode set password lock go back program chang last digit back origin good luck
530,best product comparison bournvita horlick chocol low price good test better valu nutrit littl part dha also amul indian brand must purchas product packag good fast deliveri amazon thank amazon
531,dettol doubt authent product dettol liquid total differ origin antisept liquid smell strong like antisept liquid lime fresh aroma make thik product attract pandam situat product valu money product got product rs print price rs deliveri littl bit slow issu final would like say thank amazon whole entir team great job us situat hat
532,bad smell like lifeboy mysor sandal tri take advantag competitor origin moti sandal buy duplic mysor sandal smell last minut also wast money
533,use product time roommat plan order use forget time final well last month use experi product use everi night get shower morn pro oil non greasi pretti light good smell pungent awkward fragranc hair lump togeth hair oil product give pretti good shine dark color help dandruff hairfal hairloss dens hair presenc scalp visibl time look pretti dens con find anyth alli recommend peopl hairfal issu
534,qualiti pack manufactur need improv
535,review maggi review maggi icon anyon born review pack better larg pack store open last longer regular pack eight close disadvantag plastic usag regular pack tenconclus go consum maggi longer period time one finish pack ten within week buy regular larg pack save plastic pollut
536,good product amaz product
537,bestpatanjali baba ram dev ji
538,broken
539,second thought
540,hard believ much gone qualiti aspect compar year back
541,use sinc novemb sleek eleg sit nice cupboard use keep certain small size valuabl like key cash jewelri certain document watch etc touch panel great feel soft respons velvet line great portabl con found buzzez even close cupboard door bit hard good note regular heavi duti safe person locker mention expect secur thing
542,product good final color must reddish color
543,although make rich creami lather start melt quickli kept wet need take bathroom dri next use want save much possibl costlier brand far better job brand organ happi soap skincar regimen adult sensit skin prone irrit best thing soap leav residu surpris see brand leav thin film make skin feel slipperi smooth like want skin feel nake fresh strip moistur mamaearth soap well mamaearth babi wash excel job
544,item receiv ashwagandha miss box
545,excel product smell tast flavour everi custom idea tea take without dought drink milk without milk thank amazon thank seller satisfi
546,dettol qualiti best howev valu avail amazon mrp gener liter refil pack avail market amazon prime member buy
547,hi great tast found good grandpar sure like
548,teasti
549,good floor recommend daili bath babi bath wash fragranc origin dettol liquid recommend bath wash
550,gentl cleans soap dri skin leav linger babi fragranc use yet anoth fabul stellar product mamaearth make perfect gift babi hamper
551,sweet
552,use himalaya moistur year back skin realli good soft gentl move hyderabad move differ product like olay pond lotu maybellin lakm etc happi anti age cream awesom week time see feel differ skin light light smell total like cream
553,got empti sooner expect lol good stuffedit time problem half pack empti liquid total rubbish lather liquid bottom smell like phenylrealis fake tamper packag india ever free malpractic adulteri disappoint buy
554,give color lift black hair level guess streax gem collect much better singl tube color
555,milk tea addict person although control upto thrice day sometim may exceed sinc like milk tea alot tri mani dust tea avail market tri tast wagh bakri brookebond taj societi maharsthra chai maa beti chai name like societi tea alot tea boil water give nice flavor color tea give packag nice order kg pack directli sinc alreadi knew tast valu money standpoint littl costlier rs per kg comparison tea class find worth make sure use correct method prepar get best method sens first boil water add milk directli ad milk also give good tast colour fade away case
