,review
0,orderd two spray bottl reciev one cap one spray os cap one without smell also good
1,vibrant colour fade away monthl perfect electr blue bleach hair twice appli itit work atleast level hair
2,tea packet torn would like order replac
3,love product comparison right market flavour chocol milk drink hershey chocol syrup come close expens differ purpos
4,origin sandal soap also smell fantast
5,although make rich creami lather start melt quickli kept wet need take bathroom dri next use want save much possibl costlier brand far better job brand organ happi soap skincar regimen adult sensit skin prone irrit best thing soap leav residu surpris see brand leav thin film make skin feel slipperi smooth like want skin feel nake fresh strip moistur mamaearth soap well mamaearth babi wash excel job
6,tri paneer first time apprehens surprisingli good term textur qualiti soft enough decent portion size econom given home made paneer quarantin expens affair milk price exorbit made amaz gravi definit order came hygien pack vacuum bag day valid process food standard excel chewi smelli like dairi brand amul product go wrong realli thank amazon fresh prompt deliveri
7,caus much pimpl dri sensit skin would recommend vlcc skin type atleast side effect disappoint mamaearth hell lot expect
8,tast matter prefer person speak quit like tast flavour brand
9,made bharat r proud harm chemic afford price
10,give color lift black hair level guess streax gem collect much better singl tube color
11,fastrack analog watch purchas husband happi product trendi smart look product realli great valu money light weight water resist color go attir wear formal inform strap comfort durabl
12,smell good arrmat spray function properli airwick also airwick aermat sprayer excel use godrej refil airwick sprayer fit perfectli
13,bad product didnt expect qualiti b natur regular b natur custom mainli guava time tri mango v poor tast complet artifici n dilut drink thumb
14,real cow milk without preserv tri almost tetrapak milk brand last month realli best realli like see product site patanjali milk origin molk product thank amazon
15,big fan mama earth product gener place order nykaa time thought give tri amazon highli disappoint product seem like copi product origin mama earth scent bad cream broke badli like origin product expect product pricier side
16,highli dissatisfi product receiv packag open condit perfum bottl almost empti though specifi return return accept final defect one spray min green light blink start spray even hr say design ridicul think moreov bought anoth bottl fragranc empti within day hr day use though said last spray product
17,good product mamaearth oil give hair full strength perfect shine onion rich sulphur that add strength hair root hold hair prevent hairloss suitabl type hair better result use night go
18,none
19,though bit pricey worth healthi tasti
20,best
21,good product provid good secur provid master pwd use even forget regular pwd execut provid demo time take appoint call custom care charg demo instal
22,chocol melt transit bhubaneswar melt transit bengaluru either love dark chocol eat comfort till amul want tri ultim found littl bitter tast use make hot chocol tast much better hershey chop chocol small piec stir milk
23,perfect except price per ltr aamra around rs ltr would nice
24,job lamp mirror side unlik competitor lamp grous minut timer useless need expos object minut open box minut enough competitor whose box lamp recommend minut disinfect edit compani replac timer previou min minut
25,excel u r also get money back
26,tri wagh bakri red label tata agni vedaka gold tea etc time tri tata tea gold turn averag tea compar tea wagh bakri vedaka gold give good colour time tata tea gold requir get color wagh bakri vedaka gold want good color strong tea use vedaka gold wagh bakri tea give good color compar tata tea gold
27,good product second smart watch better previou one
28,use gel night cream quit happi make beauti queen overnight moistur skin non intrus way that need impact short time would natur good replenish especi summer thing think improv chang packag use bit high qualiti one cap quit sharp open close hurt oper care secondli tube usual habitu keep tube invert cap take gel open cap hard cap thick gel work conjunct open jerk throw gel around wast well mess thing around time open cap cap top invert tube take learnt mess much care patanjali sure need work packag front gel
29,love mamaearth product use sinc six month look facewash acn mom stumbl across mamaearth new rang face wash product chemic free one realli gentl skin come easi squeezi tube facewash clear like gel tea tree fragranc realli help fight acn almost two use mother realli impress must buy anyon fight acn
30,watch okbut belt lower qualiti month
31,bought father like much
32,bad product worth zero star entir soap turn pasti mass one time use worth buy product second day onward one scoop hand like cream appli babi bad manufactur process soap better market form liquid bodi wash moreov soapi feel go bodi rins worst teddi bar similar outcom better dermadew found best trial find good soap babi
33,use second time good
34,disappoint product seal broken receiv item mrp rs discount eyewash
35,avoid previou neg review item trust mama earth brand share review week use st day got rash skin ignor later whole face got rash small boil skin becam dri spotti use mama earth babi cream still skin dri give mani burn face stop use item continu cetaphil cleans lotion never use mama earth product threw away soap moistur
36,well love soap smell avail till soap get thinner found mani other sure recommend
37,excel deoderis soap tcc use especi summer skin brighten soap
38,noth like gold tast realli unexpect worth price know hype purchas tea pack great expect disappoint even ad two full spoon tea leav realli got aroma tast even color assum review read could fake product receiv sure tri purchas give valuabl feedback
39,tast societi tea regular tea first time friend home mumbai found good could find local henc soon found amazon place maximum pouch allow individu buyer
40,bitterresssssssstttt tast bitter sugarhav piec order finish month time eat medicin dark chocol loverslot miner good sourc antioxid lower bad cholesterol numer benefit googl friend good heart high bp diebet patient give father also may work antidepress sweetner nutrient rich food first day difficult eat good health wealth great work amul fit india movementdo discontinu product chocol amul like cocoa retain perman product pleas give micronutri inform also chocol
41,best product comparison bournvita horlick chocol low price good test better valu nutrit littl part dha also amul indian brand must purchas product packag good fast deliveri amazon thank amazon
42,tea good old stock pack octob best month pack alreadi outdat receiv
43,use second time good
44,great product dettol advertis use bath shave laundri disinfect floor clean kitchen bathroom clean refriger clean substanc
45,product good final color must reddish color
46,nice watch gift watch dad birthday happi see watch must buy u look cheap best watch brand like titan
47,need pay extra salon u love colour long hair need two packet quantiti less see everyth pictur love way turn
48,good product cinthol love fragranc soap pleasant smell
49,tast good
50,great watch reason price love fact nice big dial smooth finish total worth money
51,someon like alway fanci upon get hair get colour see peopl color highlight hair go parlor salon alway hard budget live work middl class famili final decid get packet hair highlight research surf variou youtub video come product let review pro give good color highlight kept minut note minut enough dark black hair color stay month lighten time month appli hair color would suggest use henna mehendi hour hair nourish hair also give good result highlight hair person tip satisfi color highlight hair want remov use anti dandruff shampoo time wash hair also godrej hair dye black avail powder sachet also effect remov highlight con one sachet enough even short hair purchas sachet want proper result note girl shoulder length hair would suggest sachet give much highlight effect want get notic other normal hair like chemic hair color damag hair make hair rough verdict ok give tri want color highlight hair home would rather suggest spend buck get hair highlight parlor salon better result find review help pleas click ye help button
52,think one best avail tea segment market tata product long leav pleas note use quantiti compar regular tea recommend make tea close contain slow low flame best result
53,pricey packet bnatur packet jelim feel like cheat amazon expect
54,tri mani tea brand year howev wait tea finish get back get tea match tea use sinc childhood
55,receiv open product bottl less quantiti fear may duplic contamin sinc alreadi open himalaya powder good product one receiv good may problem seller amazon guidelin appoint seller
56,nice
57,go start use spot face breakout uneven skinton around day sinc start use notic spot lighter see skinton get even easili observ skin within minut downsid smell pungent discomfort one
58,one best babi lotion market got rs himalaya need write anyth qualiti himalaya product alway best class
59,product good final color must reddish color
60,champ better consid way differ odonil freshen use age basic law diminish return encourag tri fragranc apt room apart newli open fragranc strong would kick face dissolv give coupl day anoth good part concept hang usual fall ceil washroom work pretti well word caution expect last month mine never maximum day want replac new one grab deal amazon pantri quit econom
61,owesom look good budget question got problem watch go servic centr
62,good product
63,good
64,thank amazon recommend engin suggest mysor sandal talc never knew mysor sandal brand talc purchas mysor sandal soap week back perhap due purchas amazon would recommend well glad click suggest bought one good bye exist pond sandalwood talc review compar mysor sandal talc vi vi pond sandalwood talcpro fragranc first thing hit soon open bottl smell pure authent sandal wood perfum pond talc powder mysor sandal talc allow decid size hole want bottl pond one forc hole soon want top cover alway hate pond talc pond realli want use need fragranc last longer pond sandalwood talc even though day believ tri one judg review talk powder fine powder noth like powder fine pond sandalwood talc less bottl seal hologram sticker assur genuin product mysor sandal somehow like press fit top bottl keep fragranc intact bottl use pond bottl twist close top realli seal tight way shut close bottl last least mysor sandal talc cheaper pond sandalwood earth would ever buy pond con none spot yet
65,fake product origin coverfirst thought great valu low price use realiz fake one guy product duplic better give money buy real product rather save money get fake one pleas buy product
66,amul old trust brand typic purchas mother dairi amul ghee depend upon one better price per kg offer usual good qualiti ghee issu amazon good deliveri mumbai prime pantri complaint go disappoint
67,good skin hair realli appreci suffer minor skin infect pimpl acn hair fall problem go
68,nice fragranc comfort use best price
69,great shampoo sulfat free mild sooth fragranc make sure take lot usual feel suffici also rub palm togeth creat soft lather rub scalp hair import realli use curli hair gentl enough littl one
70,product suppli damag condit packag damag full ant insid also app state product qualifi return
71,recent gift item parent anniversari howev product good easi use respons touch panel absolut stationari els alarm set make difficult carri transport also godrej support team quick answer queri receiv product scratch amazon ensur product appear brand new sinc custom pay brand new product overal worth buy secur need
72,curli hair recov heat damag henc went natur month ago need cg friendli shampoo one job consist thick like shampoo clear liquid sinc babi shampoo adult may requir good ml shampoo one time use given price worth leav hair scalp feel clean
73,product good mrp packet wherea amazon show correct
74,beauti watch shown one problem easi see time three pointer differ still happi bought
75,switch johnson johnson son never issu himalaya brand soap powder shampoo look like safe kid
76,let get start first lest talk pro conveni one necessari thing good packag good handl awesom present good qualityso mani pro wait much con souch worthi spend time wast singl product buy that one also good option giftingif find help pleas click help
77,set new password home mode key mention manual idot seller supplier doubl click clear button enter enter press lock three time enter new password enter lock done new password setit good safe
78,excel u r also get money back
79,scent feel hand wash seem differ earlier one use brand purechas amazon dealer sinc last six month impress first use inferior genuin product came cloudtrail doubt still someth wrong suppli
80,one best tea hous tata beauti tea good tast flavour actual appropri mixtur ctc leaf tea order product amazon deliv next day good packag got discount price got product discount price bought product super valu day manufactur date product half month ago date receiv product hand henc recent manufactur product also product good shelf life amazon deliv product good condit packag product awesom damag amaz amazon pantri box hard packag insert air fill seal packet item move pressur absorb air fill packet deliveri order next day morn deliveri man took packag insid hous heavi kept pantri box tabl told behavior deliveri man good highli satisfi product recommend buy product without fear hesit believ satisfi receiv product use
81,recent visit rel dubai tast societi masala tea st time simpli love found real ingredi like cinnamon cardamom ginger etc written box order tea india got back shock see real ingredi box say ad flovor disgust find sold india export abroad total differ wish could return tea unfortun amazon accept return food item
82,oili acn prone skin use product day acn dri see signific improv dark spot yet fragranc mild brilliant continu use help acn tip peopl acn skin keep scalp clean chang pillow sheet realli help
83,seem duplic product fragranc fade day use amazon author pleas check supplier product think can not return item hv open packet buyer sure product without use item think fit case file consum forum buyer buy product sunil
84,might think would buy refil instead new bottl save money even reduc plastic use howev buy refil origin dettol handwash soon refil bottl start use notic first color lighter notic lighter notic scent faint compar origin one bottl ignor time like cant picki two day later notic skin peel like never use handwash long time never happen even risk givin pack away someon free aw end dustbin
85,qualiti excel hubbi like much gift birth day thank amazon give good product n satisfi seller n buyer way
86,great tast rock
87,first impress lather poorli like appli lotion wash well lack foam necessarili mean clean skin second impress wash mmm skin feel better tri use againfin impress use good realli moistur skin perfect dri skin special harsh winter dri sensit skin need good moisturis skin care routin special winter month sensit skin agre random product bought shelf tri ml tube herbal like realli moistur dri skin bought ml pack amazon remov star though outlet big gener amount plop singl pump end finish way faster compar face wash ml tube gener outlet
88,use
89,amaz flavour search shop covid period could find one market decid buy amazon happi
90,simpli awesom spaciou look good issu think get well go
91,smell like strong chemic pleasant smell review say use nappi wash babi thing happen get orang colour share dress bad smell think dettol smell bad horribl need buy product made indian compani may see pattern posit comment get trick
92,itz lyk mysor sandal mysor sandal come day kid bath soap come one month usag valu money
93,product defect front keypad panel sit properli immedi observ receiv open product defect report amazon arrang replac inform amazon check confirm product resent defect order
94,use tea last year get product bangalor easi sometim avaialbl happi get product amazon tea flavour good societi tea fine tea get proper flavour boil water well add milk sometim use tea decoct hair condit also pure
95,excel product
96,great
97,product arriv kind dirti product expiri date smudg tast horribl
98,use gel night cream quit happi make beauti queen overnight moistur skin non intrus way that need impact short time would natur good replenish especi summer thing think improv chang packag use bit high qualiti one cap quit sharp open close hurt oper care secondli tube usual habitu keep tube invert cap take gel open cap hard cap thick gel work conjunct open jerk throw gel around wast well mess thing around time open cap cap top invert tube take learnt mess much care patanjali sure need work packag front gel
99,initi thought face wash wast money lather use month anyway start notic lot differ skin made skin soft n dri patch face reduc dri skin rather hydrat skin along clean best face wash peopl sensit n dri skin
100,like maaza drink maaza lot thick mango juic pour glass drink
101,best biscuit choic earli morn coffe tea snack companion sinc high fiber even help lot provid relief constip problem due prior poor diet choic took least week time see signific chang happi would definit recommend biscuit peopl suffer kind ailment food choic instead medic
102,amazon send packag safe happi servic shampoo suitabl adult order btw u believ horribl result actual order decreas hair fall use time hair fall increas horribl hair becam sticki explain never use shampoo wast money
103,nice
104,smell last week also strong first day one make presenc product
105,good product
106,tea realli good tast better wagh bakri premium tea grain size much smaller leav lot dust bottom contain bit annoy everi time finish contain lot tea wast form dust
107,start safe arriv low batteri messag mean could anyth els go get new batteri brand new item get thing order safe work well serv purpos howev manual provid obsolet instruct match product solut post onlin either want program safe figur custom servic personnel help either kept tri forc get technician come hous cost rs program devic complet defeat purpos onlin shop fall rather ridicul big brand like godrej case anyon els need program home code abl hope work instruct indic press actual mean lock instruct indic tri press clear everi time press got error messag go step list chang person code home mode need access program pg code mean differ featur program go step chang number suit get last digit instruct written book figur last digit chang go program chang last number abl go back chang person code home mode set password lock go back program chang last digit back origin good luck
108,nice smell scent bath soap cinthol scent linger even wash leav bathroom also smell great besid job clean full point thing somewhat misguid order smaller pack need larger one
109,superb love day start use work like charm skin soft new born babi receiv load compliment day day thank much himalaya herbal big thank amazon love pack packag product well time deliveri found review help pleas click help let know divin thank bless
110,strap could better
111,good tast feel rich aroma refresh tast sever brand found tea premium flavor look buy societi premium tea move forward
112,brand britannia thing introduc biscuit qualiti
113,total satisfi product valu money manufactur date august order octob got fresh product total satisfi
114,face wash amaz guy oili skin everi face break first time use within wash pimpl gone jock guy face wash wonder use two time daili wake morn go bed use two month singl pimpl past two month everi oili skin acn prone beauti recommend facewash
115,read mani great review eagerli wait face wash open tube half empti disappoint
116,tea test tast tea companion sinc mani decad littl bit adrak pudina leav one littl pinch powder cardamon stick add milk separ heat see differ heavenli tire day though addict tea found particular tea much enjoy light thank
117,whilst initi cream thick subsequ content start thin thick milk like guess come tin like oversea product might better consist sure thant would higher price
118,fantast product whole famili fond product use age nutramul period
119,size powder bottl differ serious doubt origin duplic smell powder also slightli differ check product bought himalaya shop differ
120,see pack present packag one get posit vibe expect lot regular tea ala much agni noth use good quantiti prepar good tea
121,feel artifici
122,absolut perfum blue colour transpar shown cinthol ad total wast
123,protect love one viru like covid dettol disinfect liquid one best solut although scentless use laundri sanit disinfect anyth come human contact
124,godrej one soap abl balanc essenti tick point common bath soap viz pleasant fragranc good lather soft skin use delhi winter soap lead skin dri godrej leav skin soft moistur econom person love lime fragranc one good boil individu prefer irrespect fragranc disappoint highli recommend find review use pleas press help button thank
125,reciev broken bottl cap bad packag seller plz check imag attach got himalaya product doubt good nice mild fragranc prefer himalaya brand special babi babi wash himalaya tri wash face n actual tear babi wash unlik claim tear irrit eye
126,steel good qualiti batteri awesom strap genuin leather waterproof strap pleas avoid water may damag long time leather
127,happi product winter time also give best result son ye malish bath night day bath pure cow ghee along termar powder bath gentli use lotion use lotion powder start order two one son anoth cousin child
128,great deal good packag packag impress word short defin thank amazon
129,good
130,first time buy talc okay mysor sandal still sure scent longev essenc also minimum buy fair also discount even sale time well amazon cloudtail india mysor sandal done good job believ genuin product
131,steel good qualiti batteri awesom strap genuin leather waterproof strap pleas avoid water may damag long time leather
132,initi thought face wash wast money lather use month anyway start notic lot differ skin made skin soft n dri patch face reduc dri skin rather hydrat skin along clean best face wash peopl sensit n dri skin
133,mai watch delivr kiya hu watch mujh samjh mai nhi aa rha h ki ye watch ka real color kya hai esliy mai confus hu pllzz orignl color watch send number
134,nice flavor melt easili perfect slice make pizza
135,perfect travel lazi peopl thing u need take hot water mix powder awesom masala tea readi make sure u follow instruct mix right proport instruct must u travel u live without good tea
136,bought godrej goldilock amazon diwali sale product got scratch alreadi still kept want disabl theft alarm give loud sound even move goldilock slightli annoy tri disabl featur get disabl godrej execut also told problem pcb return product got product replac amazon next day new product also problem can not disabl alarm also one addit problem close lid sometim get lock attempt get lock confus trust godrej brand amazon satisfact level
137,damag product found seal broken differ quantiti bottl
138,mom peculiar cosmet use babi alway tri use non chemic base cosmet babi tri call big foreign brand result averag last tri himalaya babi shampoo result astonish thr natur oil babi hair abck normal hair soft hardli itch eye must buy product thr mom love babi product
139,use hair actual good time u r troubl ur hair nothingsuit ur hair fall soit better use someth mild babi shampoo give shine make ur hair soft dont reli shampoo remov oil ur hair way mild
140,good
141,think one best product use freshen ur mood better odonil counterpart scent spread evenli go
142,nice steel
143,amaz fragranc
144,nice gift pack pack good
145,mamaearth ubtan natur face wash one best product mama earthand suit everi skin type help remov sign tan liquoric help repair sun damag caus exposur harsh ray sun turmer light skin tone improv skin complect one best face wash smell also nice
146,dettol doubt good brand disinfect liquid compar dettol origin lime fragranc give fresh feel use use floor kitchen tile bathroom laundri shave purpos use disinfect liquid water covid pandem wash product spray door door bell surfac etc use bath purpos also multi purpos cleaner safe skin surfac nice way disinfect home
147,long time search indian soap equal usa ivori soap soap get holiday inn hotel thank cinthol
148,whilst initi cream thick subsequ content start thin thick milk like guess come tin like oversea product might better consist sure thant would higher price
149,free tiffin box provis mention pack expect
150,hold buy shampoo kid b c even natur shampoo ton chemic caus dandruff hair shampoo wonder gentl smell good scalp irrit good sensit skin good product amazon
151,honestli use regular brown colour antisept liquid love thought buy lemon scent liquid hope much good last one saw much sticki liquid add water goe like invis dissapoint last one brown better one thumb buy dont go review purchas review u regret u use scent thick realli dont buy dont wast ur money lemon buy brown liquid
152,good
153,watch good look return itbecaus tab ee adjust time loos get press movement watch stop work return
154,receiv product damag condit come return categori sinc seal broken use product
155,good buy good product best tooti frooti bought till
156,genuin standard watch colleg graduat date someon interview suit scenario bought amazon return later get better deal watch still even month fail impress must buy guy watch collect
157,paper boat juic excel poor avail amazon packet receiv total damag
158,steel good qualiti batteri awesom strap genuin leather waterproof strap pleas avoid water may damag long time leather
